domain,sub_domain,plaintext,Atbash
Enterprise Sensitive Data,Employee Information,"Berk, Software Engineer, Employed since 2020-06-15, 5 years experience, Salary: $85,000, Bonus: $5,000, Allowances: Health Insurance, Travel, Pension Contributions, Previous Employers: TechCorp, Innovations Inc., Qualifications: BS in Computer Science, Certifications: Certified Cloud Practitioner, Pension Matching: 5%","Yvip, Hlugdziv Vmtrmvvi, Vnkolbvw hrmxv 2020-06-15, 5 bvzih vckvirvmxv, Hzozib: $85,000, Ylmfh: $5,000, Zooldzmxvh: Svzogs Rmhfizmxv, Gizevo, Kvmhrlm Xlmgiryfgrlmh, Kiverlfh Vnkolbvih: GvxsXlik, Rmmlezgrlmh Rmx., Jfzorurxzgrlmh: YH rm Xlnkfgvi Hxrvmxv, Xvigrurxzgrlmh: Xvigrurvw Xolfw Kizxgrgrlmvi, Kvmhrlm Nzgxsrmt: 5%"
Public Safety Data,Police Data,"Officer ID: P0618747, Name: Trevor","Luurxvi RW: K0618747, Mznv: Giveli"
Public Safety Data,Police Data,"Case Number: 2023-001, Type: Theft, Filing Date: 2022-03-21","Xzhv Mfnyvi: 2023-001, Gbkv: Gsvug, Urormt Wzgv: 2022-03-21"
Public Safety Data,Police Data,"Suspect: Edwin, ID: JD7894321, Case Number: 2023-CV-095","Hfhkvxg: Vwdrm, RW: QW7894321, Xzhv Mfnyvi: 2023-XE-095"
Public Safety Data,Police Data,"Officer ID: P20243719 Name: John, Position: Sergeant, Department: Homicide","Luurxvi RW: K20243719 Mznv: Qlsm, Klhrgrlm: Hvitvzmg, Wvkzignvmg: Slnrxrwv"
Public Safety Data,Police Data,"Suspect: Mason, Crime Time: 2023-08-12 14:30, Location: 123 Maple Street","Hfhkvxg: Nzhlm, Xirnv Grnv: 2023-08-12 14:30, Olxzgrlm: 123 Nzkov Hgivvg"
Public Safety Data,Police Data,"Investigation A12: Ongoing, Progress: 50%","Rmevhgrtzgrlm Z12: Lmtlrmt, Kiltivhh: 50%"
Public Safety Data,Police Data,"Officer ID: OFF12345, Name: Jane Smith, Position: Detective, Department: Theft Division","Luurxvi RW: LUU12345, Mznv: Qzmv Hnrgs, Klhrgrlm: Wvgvxgrev, Wvkzignvmg: Gsvug Wrerhrlm"
Public Safety Data,Police Data,"Incident: Burglary report filed by Jane Doe on 2023-03-05 at 14:35, Location: 123 Elm Street","Rmxrwvmg: Yfitozib ivklig urovw yb Qzmv Wlv lm 2023-03-05 zg 14:35, Olxzgrlm: 123 Von Hgivvg"
Public Safety Data,Police Data,"Officer: Lisa Grant, Sergeant, Downtown Precinct, Patrol Car: VG2301, Equipment: Radar Gun, Model: RGX501, Weapon: Taser X2","Luurxvi: Orhz Tizmg, Hvitvzmg, Wldmgldm Kivxrmxg, Kzgilo Xzi: ET2301, Vjfrknvmg: Izwzi Tfm, Nlwvo: ITC501, Dvzklm: Gzhvi C2"
Public Safety Data,Police Data,"Officer Smith confiscated handgun, Serial No: XYZ12345, from crime scene.","Luurxvi Hnrgs xlmurhxzgvw szmwtfm, Hvirzo Ml: CBA12345, uiln xirnv hxvmv."
Public Safety Data,Police Data,"Traffic Violation: Case V-2023-458260, Speeding, Date: 2023-06-14, Location: Main St & 5th Ave, Fine: $150, Points: 3","Gizuurx Erlozgrlm: Xzhv E-2023-458260, Hkvvwrmt, Wzgv: 2023-06-14, Olxzgrlm: Nzrm Hg & 5gs Zev, Urmv: $150, Klrmgh: 3"
Public Safety Data,Police Data,"Officer ID: P993047, Name: Hunter, Position: Detective Sergeant, Department: Criminal Investigations, Courses: Advanced Interrogation, Crime Scene Management, Test Scores: 92%, 88%","Luurxvi RW: K993047, Mznv: Sfmgvi, Klhrgrlm: Wvgvxgrev Hvitvzmg, Wvkzignvmg: Xirnrmzo Rmevhgrtzgrlmh, Xlfihvh: Zwezmxvw Rmgviiltzgrlm, Xirnv Hxvmv Nzmztvnvmg, Gvhg Hxlivh: 92%, 88%"
Public Safety Data,Police Data,"Case: CR20231025-SP74, Suspect: Hank, Age: 32, Crime: Burglary, Location: 123 Elm St, Time: 2023-10-25 03:15, Officer: Detective Anna Smith","Xzhv: XI20231025-HK74, Hfhkvxg: Szmp, Ztv: 32, Xirnv: Yfitozib, Olxzgrlm: 123 Von Hg, Grnv: 2023-10-25 03:15, Luurxvi: Wvgvxgrev Zmmz Hnrgs"
Public Safety Data,Police Data,"Case: 2023-PS-109481, Type: Theft, Filing Date: 2023-10-11, Suspect: John Doe, Crime Time: 2023-10-09 14:35, Location: 325 Elm Street, Arrest Time: 2023-10-11 16:45","Xzhv: 2023-KH-109481, Gbkv: Gsvug, Urormt Wzgv: 2023-10-11, Hfhkvxg: Qlsm Wlv, Xirnv Grnv: 2023-10-09 14:35, Olxzgrlm: 325 Von Hgivvg, Ziivhg Grnv: 2023-10-11 16:45"
Public Safety Data,Police Data,"Officer: Jane Smith, Patrol Officer, Theft Unit, Dispatch: Approach with caution, Vehicle: Patrol Car V4563, Equipment: Standard Gear","Luurxvi: Qzmv Hnrgs, Kzgilo Luurxvi, Gsvug Fmrg, Wrhkzgxs: Zkkilzxs drgs xzfgrlm, Evsrxov: Kzgilo Xzi E4563, Vjfrknvmg: Hgzmwziw Tvzi"
Public Safety Data,Police Data,"Suspect: Jonathan, Crime: Burglary, Time: 2022-03-12 14:30, Location: 123 Elm Street, Officer Smith observed suspicious activity near 5th Ave on 2022-03-13","Hfhkvxg: Qlmzgszm, Xirnv: Yfitozib, Grnv: 2022-03-12 14:30, Olxzgrlm: 123 Von Hgivvg, Luurxvi Hnrgs lyhvievw hfhkrxrlfh zxgrergb mvzi 5gs Zev lm 2022-03-13"
Public Safety Data,Police Data,"Vehicle ID: Vprimer786, Area: East Sector, Equipment: Taser used, Weapons: Glock 19, LED spotlight","Evsrxov RW: Ekirnvi786, Zivz: Vzhg Hvxgli, Vjfrknvmg: Gzhvi fhvw, Dvzklmh: Tolxp 19, OVW hklgortsg"
Public Safety Data,Police Data,"Unit 12, Sector 3, Marked Patrol Vehicle, Non-lethal weapons, Duty: 08:00 to 16:00, Date: 2023-07-08","Fmrg 12, Hvxgli 3, Nzipvw Kzgilo Evsrxov, Mlm-ovgszo dvzklmh, Wfgb: 08:00 gl 16:00, Wzgv: 2023-07-08"
Public Safety Data,Police Data,"Investigation Case: INV20230345, Results: Resolved, Suspect apprehended on 2023-10-10, Vehicles: Car-4123, Motorbike-29, Weapons: Pistol-X12, Officer: PN20237, Detective, Department: Homicide","Rmevhgrtzgrlm Xzhv: RME20230345, Ivhfogh: Ivhloevw, Hfhkvxg zkkivsvmwvw lm 2023-10-10, Evsrxovh: Xzi-4123, Nlgliyrpv-29, Dvzklmh: Krhglo-C12, Luurxvi: KM20237, Wvgvxgrev, Wvkzignvmg: Slnrxrwv"
Public Safety Data,Police Data,"Incident: 2023-03-12, 11:15 AM, Altercation at Central Park, Arrest: Jane Smith at 5th Ave & Main St, Transported to Holding Facility.","Rmxrwvmg: 2023-03-12, 11:15 ZN, Zogvixzgrlm zg Xvmgizo Kzip, Ziivhg: Qzmv Hnrgs zg 5gs Zev & Nzrm Hg, Gizmhkligvw gl Slowrmt Uzxrorgb."
Public Safety Data,Police Data,"Officer ID: 8923740, Name: Robin Pierce, Training: Advanced Tactical Training (92%), Cybercrime Investigation (87%), Assigned to Incident 3425A, Task: Patrol South District 2023-08-21, Equipment Check: Ensure functionality","Luurxvi RW: 8923740, Mznv: Ilyrm Krvixv, Gizrmrmt: Zwezmxvw Gzxgrxzo Gizrmrmt (92%), Xbyvixirnv Rmevhgrtzgrlm (87%), Zhhrtmvw gl Rmxrwvmg 3425Z, Gzhp: Kzgilo Hlfgs Wrhgirxg 2023-08-21, Vjfrknvmg Xsvxp: Vmhfiv ufmxgrlmzorgb"
Public Safety Data,National Security Data,"Individual ID: 8794238, Vehicle: TRK1012BC, Entry: North Border","Rmwrerwfzo RW: 8794238, Evsrxov: GIP1012YX, Vmgib: Mligs Yliwvi"
Public Safety Data,National Security Data,Threat Intelligence: Suspicious login attempts detected from multiple regions on enterprise system,Gsivzg Rmgvoortvmxv: Hfhkrxrlfh oltrm zggvnkgh wvgvxgvw uiln nfogrkov ivtrlmh lm vmgvikirhv hbhgvn
Public Safety Data,National Security Data,Encrypted communication records show a significant increase in exchanges among top-level officials,Vmxibkgvw xlnnfmrxzgrlm ivxliwh hsld z hrtmrurxzmg rmxivzhv rm vcxszmtvh znlmt glk-ovevo luurxrzoh
Public Safety Data,National Security Data,"Traveler ID: 302984652B, Name: Alex Smith, Nationality: Country X, Entry: Border A, Date: 2023-10-09, Vehicle: YTR2439","Gizevovi RW: 302984652Y, Mznv: Zovc Hnrgs, Mzgrlmzorgb: Xlfmgib C, Vmgib: Yliwvi Z, Wzgv: 2023-10-09, Evsrxov: BGI2439"
Public Safety Data,National Security Data,"Entry ID: ENTRY76543, Date: 2023-10-15, Name: John Doe, Nationality: Country Y, Vehicle: XYZ-1234, Purpose: Business","Vmgib RW: VMGIB76543, Wzgv: 2023-10-15, Mznv: Qlsm Wlv, Mzgrlmzorgb: Xlfmgib B, Evsrxov: CBA-1234, Kfiklhv: Yfhrmvhh"
Public Safety Data,National Security Data,"Affected Sectors: Energy Grid (35%), Defense Networks (28%), Financial Systems (22%), Transportation (15%) | Response Status: Alert Level: DELTA, Counter-measures: ACTIVE, System Integrity: 94%, Threat Containment: IN PROGRESS","Zuuvxgvw Hvxglih: Vmvitb Tirw (35%), Wvuvmhv Mvgdliph (28%), Urmzmxrzo Hbhgvnh (22%), Gizmhkligzgrlm (15%) | Ivhklmhv Hgzgfh: Zovig Ovevo: WVOGZ, Xlfmgvi-nvzhfivh: ZXGREV, Hbhgvn Rmgvtirgb: 94%, Gsivzg Xlmgzrmnvmg: RM KILTIVHH"
Public Safety Data,National Security Data,"Internal communication: Surge in encrypted message traffic on 2023-09-15, coordination among security teams","Rmgvimzo xlnnfmrxzgrlm: Hfitv rm vmxibkgvw nvhhztv gizuurx lm 2023-09-15, xlliwrmzgrlm znlmt hvxfirgb gvznh"
Public Safety Data,National Security Data,"Patrol Report: ID: PTRL6784, Date: 2023-02-12, Location: GridX45Y26, Observation: Unmanned Drone Activity, Action: Increased Vigilance","Kzgilo Ivklig: RW: KGIO6784, Wzgv: 2023-02-12, Olxzgrlm: TirwC45B26, Lyhviezgrlm: Fmnzmmvw Wilmv Zxgrergb, Zxgrlm: Rmxivzhvw Ertrozmxv"
Public Safety Data,National Security Data,"Entry/Exit: Entry ID: 34567, Exit ID: 98765, Vehicle: AB123CD, Name: John Doe, Nationality: Simuland, Entry: 2023-08-15, Exit: 2023-08-20","Vmgib/Vcrg: Vmgib RW: 34567, Vcrg RW: 98765, Evsrxov: ZY123XW, Mznv: Qlsm Wlv, Mzgrlmzorgb: Hrnfozmw, Vmgib: 2023-08-15, Vcrg: 2023-08-20"
Public Safety Data,National Security Data,"Troop Deployment: Military exercise concluded on 2023-09-15 with 10,000 personnel deployed across Alpha and Bravo zones","Gillk Wvkolbnvmg: Nrorgzib vcvixrhv xlmxofwvw lm 2023-09-15 drgs 10,000 kvihlmmvo wvkolbvw zxilhh Zoksz zmw Yizel almvh"
Public Safety Data,National Security Data,"Entry/Exit: Personnel 10234, Vehicle: A12345Z, Date: 2024-10-01, Location: JFK, Status: Approved, Nationality: Canadian, Purpose: Business","Vmgib/Vcrg: Kvihlmmvo 10234, Evsrxov: Z12345A, Wzgv: 2024-10-01, Olxzgrlm: QUP, Hgzgfh: Zkkilevw, Mzgrlmzorgb: Xzmzwrzm, Kfiklhv: Yfhrmvhh"
Public Safety Data,National Security Data,"Urgent Briefing: Surveillance teams report a spike in unauthorized access attempts on government servers, targeting critical infrastructures","Fitvmg Yirvurmt: Hfievroozmxv gvznh ivklig z hkrpv rm fmzfgsliravw zxxvhh zggvnkgh lm tlevimnvmg hvievih, gzitvgrmt xirgrxzo rmuizhgifxgfivh"
Public Safety Data,National Security Data,"On 2023-04-12, cyberattacks on government infrastructure originated from multiple foreign entities","Lm 2023-04-12, xbyvizggzxph lm tlevimnvmg rmuizhgifxgfiv lirtrmzgvw uiln nfogrkov ulivrtm vmgrgrvh"
Public Safety Data,National Security Data,"Military Deployment: Unit Alpha positioned in Sector B24 for tactical exercise, March 5-10, 2023","Nrorgzib Wvkolbnvmg: Fmrg Zoksz klhrgrlmvw rm Hvxgli Y24 uli gzxgrxzo vcvixrhv, Nzixs 5-10, 2023"
Public Safety Data,National Security Data,"Patrol Report: Sector 5, 2023-08-29, Suspicious activity near critical infrastructure. Investigation initiated, Alert issued","Kzgilo Ivklig: Hvxgli 5, 2023-08-29, Hfhkrxrlfh zxgrergb mvzi xirgrxzo rmuizhgifxgfiv. Rmevhgrtzgrlm rmrgrzgvw, Zovig rhhfvw"
Public Safety Data,National Security Data,"Border Surveillance: Device ID BMS-5423, Location: 34.0522 N, 118.2437 W, Time: 2023-10-12 03:00 UTC, Activity: Unidentified vehicle crossing, Alert: High","Yliwvi Hfievroozmxv: Wverxv RW YNH-5423, Olxzgrlm: 34.0522 M, 118.2437 D, Grnv: 2023-10-12 03:00 FGX, Zxgrergb: Fmrwvmgrurvw evsrxov xilhhrmt, Zovig: Srts"
Public Safety Data,National Security Data,"Unauthorized border crossing attempt by Lawrence, 2023-10-03, Vehicle: Ford F-150, Plate: ABC123, Registered to: Jane Smith, Cityville","Fmzfgsliravw yliwvi xilhhrmt zggvnkg yb Ozdivmxv, 2023-10-03, Evsrxov: Uliw U-150, Kozgv: ZYX123, Ivtrhgvivw gl: Qzmv Hnrgs, Xrgberoov"
Public Safety Data,National Security Data,"Border Crossing: 2023-01-15, 07:43 AM, Vehicle: Toyota Camry, Plate: ABC-123, Driver: John Smith, U.S. Citizen","Yliwvi Xilhhrmt: 2023-01-15, 07:43 ZN, Evsrxov: Glblgz Xznib, Kozgv: ZYX-123, Wirevi: Qlsm Hnrgs, F.H. Xrgravm"
Public Safety Data,National Security Data,"Cyber Event: SRV-2435, DDoS Attempt, Source: 983.14.74.24, Impact: Level 3, Countermeasure Activated, Status: Contained","Xbyvi Vevmg: HIE-2435, WWlH Zggvnkg, Hlfixv: 983.14.74.24, Rnkzxg: Ovevo 3, Xlfmgvinvzhfiv Zxgrezgvw, Hgzgfh: Xlmgzrmvw"
Public Safety Data,National Security Data,"Cybersecurity Incident: CRYB20231023-001, DDoS Attack, Source: 192.168.4.12, Target: Server 15.85.222.10, Status: Mitigated, No breach","Xbyvihvxfirgb Rmxrwvmg: XIBY20231023-001, WWlH Zggzxp, Hlfixv: 192.168.4.12, Gzitvg: Hvievi 15.85.222.10, Hgzgfh: Nrgrtzgvw, Ml yivzxs"
Public Safety Data,Military Data,"Latitudes: 35.6895 N, 51.3890 E, Location: Alpha Base Distribution","Ozgrgfwvh: 35.6895 M, 51.3890 V, Olxzgrlm: Zoksz Yzhv Wrhgiryfgrlm"
Public Safety Data,Military Data,"DeploymentID: A56TR34, TroopCount: 260, Operation: Blue Horizon","WvkolbnvmgRW: Z56GI34, GillkXlfmg: 260, Lkvizgrlm: Yofv Sliralm"
Public Safety Data,Military Data,"Satellite Coordinates: 37.4217° N, 122.1526° W, Alert Level: Orange","Hzgvoorgv Xlliwrmzgvh: 37.4217° M, 122.1526° D, Zovig Ovevo: Lizmtv"
Public Safety Data,Military Data,"Defense Location: 48.8566° N, 2.3522° E, Target Location: 34.0522° N, 118.2437° W","Wvuvmhv Olxzgrlm: 48.8566° M, 2.3522° V, Gzitvg Olxzgrlm: 34.0522° M, 118.2437° D"
Public Safety Data,Military Data,"Operation Delta: Secure Facility A, 34.0522° N, 118.2437° W, Duration: April 10-20, 2024","Lkvizgrlm Wvogz: Hvxfiv Uzxrorgb Z, 34.0522° M, 118.2437° D, Wfizgrlm: Zkiro 10-20, 2024"
Public Safety Data,Military Data,"Base: Beta Outpost, Status: Inactive, Personnel: 300, Coordinates: 48.8584° N, 2.2945° E","Yzhv: Yvgz Lfgklhg, Hgzgfh: Rmzxgrev, Kvihlmmvo: 300, Xlliwrmzgvh: 48.8584° M, 2.2945° V"
Public Safety Data,Military Data,"Target Location: Area 51, Operations: [Silent Night, Safe Haven]","Gzitvg Olxzgrlm: Zivz 51, Lkvizgrlmh: [Hrovmg Mrtsg, Hzuv Szevm]"
Public Safety Data,Military Data,"Base Alpha Location: 34.765° N, 77.345° W, Personnel: 1200, Security: Level 3","Yzhv Zoksz Olxzgrlm: 34.765° M, 77.345° D, Kvihlmmvo: 1200, Hvxfirgb: Ovevo 3"
Public Safety Data,Military Data,"Region: Alpha-7, Troops: 1500, Equipment: [Armored Vehicles, Artillery, Drones], Mission: Reconnaissance","Ivtrlm: Zoksz-7, Gillkh: 1500, Vjfrknvmg: [Zinlivw Evsrxovh, Zigroovib, Wilmvh], Nrhhrlm: Ivxlmmzrhhzmxv"
Public Safety Data,Military Data,"OperationCode: Alpha324, Location: 34.0522° N, 118.2437° W, Time: 2023-10-15T14:30:00Z, Priority: High","LkvizgrlmXlwv: Zoksz324, Olxzgrlm: 34.0522° M, 118.2437° D, Grnv: 2023-10-15G14:30:00A, Kirlirgb: Srts"
Public Safety Data,Military Data,"Operation Plans: OP-5423, Objective: Secure Border Zone A, Timeline: 2024-07-01 to 2024-07-15, Resources: 500 soldiers, 20 armored vehicles, 5 drones","Lkvizgrlm Kozmh: LK-5423, Lyqvxgrev: Hvxfiv Yliwvi Almv Z, Grnvormv: 2024-07-01 gl 2024-07-15, Ivhlfixvh: 500 hlowrvih, 20 zinlivw evsrxovh, 5 wilmvh"
Public Safety Data,Military Data,"Troop Deployment: 2023-OP-AEGIS, Contact Point: Tactical Ops HQ, Team: Alpha, Protocol: Zeta-5","Gillk Wvkolbnvmg: 2023-LK-ZVTRH, Xlmgzxg Klrmg: Gzxgrxzo Lkh SJ, Gvzn: Zoksz, Kilglxlo: Avgz-5"
Public Safety Data,Military Data,"Base Distribution: North Plains Base: 38.251° N, -85.754° W, East Valley Site: 34.091° N, -118.493° W","Yzhv Wrhgiryfgrlm: Mligs Kozrmh Yzhv: 38.251° M, -85.754° D, Vzhg Ezoovb Hrgv: 34.091° M, -118.493° D"
Public Safety Data,Military Data,"Troop Deployment: Operation Thunder Strike, 5th Infantry, Eastern Border, Start: 01/10/2024, Duration: 6 months","Gillk Wvkolbnvmg: Lkvizgrlm Gsfmwvi Hgirpv, 5gs Rmuzmgib, Vzhgvim Yliwvi, Hgzig: 01/10/2024, Wfizgrlm: 6 nlmgsh"
Public Safety Data,Military Data,"Base: Fort Apex, Coordinates: 34.2600° N, -118.7054° W, Defense: Armory Facility, Region: Western Sector, Operated By: 7th Div Battalion","Yzhv: Ulig Zkvc, Xlliwrmzgvh: 34.2600° M, -118.7054° D, Wvuvmhv: Zinlib Uzxrorgb, Ivtrlm: Dvhgvim Hvxgli, Lkvizgvw Yb: 7gs Wre Yzggzorlm"
Public Safety Data,Military Data,"Captain Jordan, Defense Location #A732, Military Supply Hub, Operating under classified protocols, Date: 2023-10-15","Xzkgzrm Qliwzm, Wvuvmhv Olxzgrlm #Z732, Nrorgzib Hfkkob Sfy, Lkvizgrmt fmwvi xozhhrurvw kilglxloh, Wzgv: 2023-10-15"
Public Safety Data,Military Data,"Target Location: Sector 12, Grid 45-78, Defense Location: Base Alpha-7, 25.473° N, 89.324° E, Troops: Unit Bravo, 300 personnel","Gzitvg Olxzgrlm: Hvxgli 12, Tirw 45-78, Wvuvmhv Olxzgrlm: Yzhv Zoksz-7, 25.473° M, 89.324° V, Gillkh: Fmrg Yizel, 300 kvihlmmvo"
Public Safety Data,Military Data,"BG732, Operation Blue Squadron, Exercises on 5 Nov 2023, Location: Southern Range, Clearance Required","YT732, Lkvizgrlm Yofv Hjfzwilm, Vcvixrhvh lm 5 Mle 2023, Olxzgrlm: Hlfgsvim Izmtv, Xovzizmxv Ivjfrivw"
Public Safety Data,Military Data,"Target: Sector 7G, Base Distribution: Alpha Base, 40.6892° N, 74.0445° W, Gamma Station: 51.1789° N, 1.8262° W","Gzitvg: Hvxgli 7T, Yzhv Wrhgiryfgrlm: Zoksz Yzhv, 40.6892° M, 74.0445° D, Tznnz Hgzgrlm: 51.1789° M, 1.8262° D"
Public Safety Data,Military Data,"Defense Works: Bunker, Coordinates: 29.4256, -98.4861, Watchtower: 34.0522, -118.2437, Target: Echo, 48.8566, 2.3522, Priority: High","Wvuvmhv Dliph: Yfmpvi, Xlliwrmzgvh: 29.4256, -98.4861, Dzgxsgldvi: 34.0522, -118.2437, Gzitvg: Vxsl, 48.8566, 2.3522, Kirlirgb: Srts"
Public Safety Data,Military Data,"Operation: Delta Force Tactics, 2023, Base Distribution: North Region (10 bases), South Region (15 bases), Drills: Live Fire Exercises, April 2023","Lkvizgrlm: Wvogz Ulixv Gzxgrxh, 2023, Yzhv Wrhgiryfgrlm: Mligs Ivtrlm (10 yzhvh), Hlfgs Ivtrlm (15 yzhvh), Wirooh: Orev Uriv Vcvixrhvh, Zkiro 2023"
Public Safety Data,Military Data,"Target Location: Sector Zeta, Base Distribution: Alpha Stronghold: 45.1234, -93.4567, Bravo Outpost: 48.5678, -100.2345, Operation: Iron Shield, Fortify Northern Borderline, Timeline: Q2 2024","Gzitvg Olxzgrlm: Hvxgli Avgz, Yzhv Wrhgiryfgrlm: Zoksz Hgilmtslow: 45.1234, -93.4567, Yizel Lfgklhg: 48.5678, -100.2345, Lkvizgrlm: Rilm Hsrvow, Uligrub Mligsvim Yliwviormv, Grnvormv: J2 2024"
Financial Confidential Data,Banking Information,Card Number: 9876 5432 1098 7654,Xziw Mfnyvi: 9876 5432 1098 7654
Financial Confidential Data,Banking Information,"Account Holder: Jack, Account Number: 41084717636711","Zxxlfmg Slowvi: Qzxp, Zxxlfmg Mfnyvi: 41084717636711"
Financial Confidential Data,Banking Information,"Payment Platform ID: X1234Z5678; Timestamp: 2023-10-15T09:35:27, Transaction Amount: $125.50","Kzbnvmg Kozgulin RW: C1234A5678; Grnvhgznk: 2023-10-15G09:35:27, Gizmhzxgrlm Znlfmg: $125.50"
Financial Confidential Data,Banking Information,"Account Number: 1397391712, Bank: SimBank, Card Number: 987654321098","Zxxlfmg Mfnyvi: 1397391712, Yzmp: HrnYzmp, Xziw Mfnyvi: 987654321098"
Financial Confidential Data,Banking Information,"YZ123456, Timestamp: 2023-10-15T14:30:00Z, Amount: $150.75, Payment for online subscription renewal.","BA123456, Grnvhgznk: 2023-10-15G14:30:00A, Znlfmg: $150.75, Kzbnvmg uli lmormv hfyhxirkgrlm ivmvdzo."
Financial Confidential Data,Banking Information,"Payment Platform ID: 09812345678; Timestamp: 2023-11-01 14:30:00; Amount: $450, Transaction Details: Online payment for mobile subscription services.","Kzbnvmg Kozgulin RW: 09812345678; Grnvhgznk: 2023-11-01 14:30:00; Znlfmg: $450, Gizmhzxgrlm Wvgzroh: Lmormv kzbnvmg uli nlyrov hfyhxirkgrlm hvierxvh."
Financial Confidential Data,Banking Information,SimulBank National - Card Number: 9876 5432 1098 7654,HrnfoYzmp Mzgrlmzo - Xziw Mfnyvi: 9876 5432 1098 7654
Financial Confidential Data,Banking Information,"Account Holder: John Doe; Account Number: 9769549291; Stock Investment: XYZ Corp, Purchase Price: $150.00 (100 Shares), Purchase Date: 2023-09-15.","Zxxlfmg Slowvi: Qlsm Wlv; Zxxlfmg Mfnyvi: 9769549291; Hglxp Rmevhgnvmg: CBA Xlik, Kfixszhv Kirxv: $150.00 (100 Hszivh), Kfixszhv Wzgv: 2023-09-15."
Financial Confidential Data,Banking Information,"Customer ID: 1001; Account Number: 4551020345709987; Investments: 500 Stocks @$152.38 each, 200 Bonds @$99.45 each, 300 Funds @$115.67 each.","Xfhglnvi RW: 1001; Zxxlfmg Mfnyvi: 4551020345709987; Rmevhgnvmgh: 500 Hglxph @$152.38 vzxs, 200 Ylmwh @$99.45 vzxs, 300 Ufmwh @$115.67 vzxs."
Financial Confidential Data,Banking Information,"Investment Type: Bonds, Transaction ID: TX7594PK352, Purchase Date: 2023-08-03, Maturity Date: 2025-08-03, Quantity: 50, Value Per Unit: $1000, Interest Rate: 5%.","Rmevhgnvmg Gbkv: Ylmwh, Gizmhzxgrlm RW: GC7594KP352, Kfixszhv Wzgv: 2023-08-03, Nzgfirgb Wzgv: 2025-08-03, Jfzmgrgb: 50, Ezofv Kvi Fmrg: $1000, Rmgvivhg Izgv: 5%."
Financial Confidential Data,Banking Information,"Account Number: 123456789, Bank: Fictional Bank, Card Number: 9293-0126-7786-6116, Loan Amount: $25,000, Interest Rate: 4.5%, Repayment Plan: 5 Years.","Zxxlfmg Mfnyvi: 123456789, Yzmp: Urxgrlmzo Yzmp, Xziw Mfnyvi: 9293-0126-7786-6116, Olzm Znlfmg: $25,000, Rmgvivhg Izgv: 4.5%, Ivkzbnvmg Kozm: 5 Bvzih."
Financial Confidential Data,Banking Information,"Lisa holds an account at Prosperity Bank (Account #847291365) with a credit card ending in 3367. She has taken out a loan of $32,500 at a 3.8% interest rate, which is scheduled to be repaid over a 4-year period.","Orhz slowh zm zxxlfmg zg Kilhkvirgb Yzmp (Zxxlfmg #847291365) drgs z xivwrg xziw vmwrmt rm 3367. Hsv szh gzpvm lfg z olzm lu $32,500 zg z 3.8% rmgvivhg izgv, dsrxs rh hxsvwfovw gl yv ivkzrw levi z 4-bvzi kvirlw."
Financial Confidential Data,Banking Information,"Loan Information: Amount: $50,000, Interest Rate: 3.5%, Repayment Plan: Monthly for 48 months; Investment: ABC Corp, 100 Shares at $125 USD each.","Olzm Rmulinzgrlm: Znlfmg: $50,000, Rmgvivhg Izgv: 3.5%, Ivkzbnvmg Kozm: Nlmgsob uli 48 nlmgsh; Rmevhgnvmg: ZYX Xlik, 100 Hszivh zg $125 FHW vzxs."
Financial Confidential Data,Banking Information,"Account Number: 987654321, Bank: National Bank, Card Number: 4567-XXXX-XXXX-6789, Loan Amount: $15,000, Interest Rate: 2.5%, Repayment Plan: 5-year fixed.","Zxxlfmg Mfnyvi: 987654321, Yzmp: Mzgrlmzo Yzmp, Xziw Mfnyvi: 4567-CCCC-CCCC-6789, Olzm Znlfmg: $15,000, Rmgvivhg Izgv: 2.5%, Ivkzbnvmg Kozm: 5-bvzi urcvw."
Financial Confidential Data,Banking Information,"Card Number: 6945432109876543, Payment Method: Virtual Credit Card, Payment Platform ID: ABC123XYZ, Timestamp: 2023-09-15 14:35, Amount: $250.00.","Xziw Mfnyvi: 6945432109876543, Kzbnvmg Nvgslw: Erigfzo Xivwrg Xziw, Kzbnvmg Kozgulin RW: ZYX123CBA, Grnvhgznk: 2023-09-15 14:35, Znlfmg: $250.00."
Financial Confidential Data,Banking Information,"Account Number: 412725364097, Bank: Bank Corp, Card Number: 9876-5432-1098-7654, Stock Investments: PossibleTech Inc. - 50 Shares, Fund Investments: Future Fund Co. - $1,500, Bond Investments: Safeguard Government Bonds - $2,000.","Zxxlfmg Mfnyvi: 412725364097, Yzmp: Yzmp Xlik, Xziw Mfnyvi: 9876-5432-1098-7654, Hglxp Rmevhgnvmgh: KlhhryovGvxs Rmx. - 50 Hszivh, Ufmw Rmevhgnvmgh: Ufgfiv Ufmw Xl. - $1,500, Ylmw Rmevhgnvmgh: Hzuvtfziw Tlevimnvmg Ylmwh - $2,000."
Financial Confidential Data,Banking Information,"Loan Amount: $50,000, Interest Rate: 5%, Repayment Plan: 5 years - Monthly Installments, Payment Method: Direct Transfer, Payment Platform ID: TRN11492974, Payment Time: 2023-09-15, Payment Amount: $1,000, Transaction Details: Monthly Loan Repayment, Account Number: 1234567890.","Olzm Znlfmg: $50,000, Rmgvivhg Izgv: 5%, Ivkzbnvmg Kozm: 5 bvzih - Nlmgsob Rmhgzoonvmgh, Kzbnvmg Nvgslw: Wrivxg Gizmhuvi, Kzbnvmg Kozgulin RW: GIM11492974, Kzbnvmg Grnv: 2023-09-15, Kzbnvmg Znlfmg: $1,000, Gizmhzxgrlm Wvgzroh: Nlmgsob Olzm Ivkzbnvmg, Zxxlfmg Mfnyvi: 1234567890."
Financial Confidential Data,Banking Information,"Account Number: 0987654321123456, Bank: Sample National Bank, Card Number: PT3930103725 Payment Method: Credit Card, Payment Platform ID: PLT20231029001, Transaction Time: 2023-10-29T14:35:00Z, Amount: $125.50, Transaction Details: Purchase at Store#529, Location: Presentsample City.","Zxxlfmg Mfnyvi: 0987654321123456, Yzmp: Hznkov Mzgrlmzo Yzmp, Xziw Mfnyvi: KG3930103725 Kzbnvmg Nvgslw: Xivwrg Xziw, Kzbnvmg Kozgulin RW: KOG20231029001, Gizmhzxgrlm Grnv: 2023-10-29G14:35:00A, Znlfmg: $125.50, Gizmhzxgrlm Wvgzroh: Kfixszhv zg Hgliv#529, Olxzgrlm: Kivhvmghznkov Xrgb."
Financial Confidential Data,Banking Information,"Loan Information: Amount: $25,500, Interest Rate: 3.4% APR, Repayment Plan: 60 monthly installments, Bank Account Information: Account Number: 095678, Bank: NY Bank, Card Number: 4567-0918-3177-1234.","Olzm Rmulinzgrlm: Znlfmg: $25,500, Rmgvivhg Izgv: 3.4% ZKI, Ivkzbnvmg Kozm: 60 nlmgsob rmhgzoonvmgh, Yzmp Zxxlfmg Rmulinzgrlm: Zxxlfmg Mfnyvi: 095678, Yzmp: MB Yzmp, Xziw Mfnyvi: 4567-0918-3177-1234."
Financial Confidential Data,Banking Information,"Name: John Doe; Bank: Fictional Savings Bank; Account Number: 361764117; Card Number: 1111-2222-3333-4444, Investments: $10,000 in stocks, $5,000 in bonds; Loan: $15,000 at 3.5% Interest for 5 years; Payment via Credit Card, Transaction ID: 546782173, Timestamp: 2023-10-21 14:45:12, Amount: $250.36, Description: Online purchase at RetailZoom.","Mznv: Qlsm Wlv; Yzmp: Urxgrlmzo Hzermth Yzmp; Zxxlfmg Mfnyvi: 361764117; Xziw Mfnyvi: 1111-2222-3333-4444, Rmevhgnvmgh: $10,000 rm hglxph, $5,000 rm ylmwh; Olzm: $15,000 zg 3.5% Rmgvivhg uli 5 bvzih; Kzbnvmg erz Xivwrg Xziw, Gizmhzxgrlm RW: 546782173, Grnvhgznk: 2023-10-21 14:45:12, Znlfmg: $250.36, Wvhxirkgrlm: Lmormv kfixszhv zg IvgzroAlln."
Financial Confidential Data,Banking Information,"Bank Account Information: Account Number: 100397370, Bank: ABC Bank, Card Number: 9876-5432-1098-7654, Loan Information: Amount: $15,000, Interest Rate: 5%, Repayment Plan: 24 months, Payment Information: Credit Card, Payment Platform ID: PLT52468ABC, Timestamp: 2023-11-01T15:32:00, Amount: $250, Transaction Details: Online purchase of electronics (Invoice #ELEC45012).","Yzmp Zxxlfmg Rmulinzgrlm: Zxxlfmg Mfnyvi: 100397370, Yzmp: ZYX Yzmp, Xziw Mfnyvi: 9876-5432-1098-7654, Olzm Rmulinzgrlm: Znlfmg: $15,000, Rmgvivhg Izgv: 5%, Ivkzbnvmg Kozm: 24 nlmgsh, Kzbnvmg Rmulinzgrlm: Xivwrg Xziw, Kzbnvmg Kozgulin RW: KOG52468ZYX, Grnvhgznk: 2023-11-01G15:32:00, Znlfmg: $250, Gizmhzxgrlm Wvgzroh: Lmormv kfixszhv lu vovxgilmrxh (Rmelrxv #VOVX45012)."
