domain,sub_domain,plaintext,Atbash
Internet Records,User Preferences,"User ID: U987654321, Timestamp: 2023-11-05T14:30:45Z, Interest Categories: Travel, Food, Photography, Recent Ad Clicks: [Travel Deals, Gourmet Recipes, Camera Accessories], Action Taken: Click-through.","Fhvi RW: F987654321, Grnvhgznk: 2023-11-05G14:30:45A, Rmgvivhg Xzgvtlirvh: Gizevo, Ullw, Kslgltizksb, Ivxvmg Zw Xorxph: [Gizevo Wvzoh, Tlfinvg Ivxrkvh, Xznviz Zxxvhhlirvh], Zxgrlm Gzpvm: Xorxp-gsilfts."
Internet Records,User Preferences,"User456 prefers a light theme with a small font size for a minimalist interface. Privacy settings are strict, with all cookies and tracking disabled. These preferences are consistent across all devices.","Fhvi456 kivuvih z ortsg gsvnv drgs z hnzoo ulmg hrav uli z nrmrnzorhg rmgviuzxv. Kirezxb hvggrmth ziv hgirxg, drgs zoo xllprvh zmw gizxprmt wrhzyovw. Gsvhv kivuvivmxvh ziv xlmhrhgvmg zxilhh zoo wverxvh."
Internet Records,User Preferences,"Notification Preferences: User prefers push notifications for breaking news and weather updates. Privacy Preferences: Cookies are enabled for essential functions only, and tracking is limited to anonymized data.","Mlgrurxzgrlm Kivuvivmxvh: Fhvi kivuvih kfhs mlgrurxzgrlmh uli yivzprmt mvdh zmw dvzgsvi fkwzgvh. Kirezxb Kivuvivmxvh: Xllprvh ziv vmzyovw uli vhhvmgrzo ufmxgrlmh lmob, zmw gizxprmt rh ornrgvw gl zmlmbnravw wzgz."
Internet Records,User Preferences,"Notification Preferences: User prefers push notifications for updates related only to subscribed topics such as technology and health. Privacy Preferences: Cookies are disabled, and tracking is not allowed for enhanced privacy.","Mlgrurxzgrlm Kivuvivmxvh: Fhvi kivuvih kfhs mlgrurxzgrlmh uli fkwzgvh ivozgvw lmob gl hfyhxiryvw glkrxh hfxs zh gvxsmloltb zmw svzogs. Kirezxb Kivuvivmxvh: Xllprvh ziv wrhzyovw, zmw gizxprmt rh mlg zooldvw uli vmszmxvw kirezxb."
Internet Records,User Preferences,"User123 favors dark mode for a sleeker interface appearance and selects a larger font size for readability. Privacy settings are bolstered by disallowing cookies and declining any form of tracking, ensuring maximum personal data protection.","Fhvi123 uzelih wzip nlwv uli z hovvpvi rmgviuzxv zkkvzizmxv zmw hvovxgh z ozitvi ulmg hrav uli ivzwzyrorgb. Kirezxb hvggrmth ziv ylohgvivw yb wrhzooldrmt xllprvh zmw wvxormrmt zmb ulin lu gizxprmt, vmhfirmt nzcrnfn kvihlmzo wzgz kilgvxgrlm."
Internet Records,User Preferences,"User: Emma; Active Time Periods: 08:00-10:00 and 20:00-23:00; Content Consumption Habits: Reads an average of 10 articles daily, with a preference for technology and health topics, and watches videos for approximately 2 hours, mainly focusing on educational content.","Fhvi: Vnnz; Zxgrev Grnv Kvirlwh: 08:00-10:00 zmw 20:00-23:00; Xlmgvmg Xlmhfnkgrlm Szyrgh: Ivzwh zm zeviztv lu 10 zigrxovh wzrob, drgs z kivuvivmxv uli gvxsmloltb zmw svzogs glkrxh, zmw dzgxsvh erwvlh uli zkkilcrnzgvob 2 slfih, nzrmob ulxfhrmt lm vwfxzgrlmzo xlmgvmg."
Internet Records,User Preferences,"User X logged in daily, averaging 2 hours of social media consumption. Their daily reading volume is about 15 articles, with session durations averaging 5 minutes per article. User X interacts frequently, with an average of 10 likes, 5 comments, and 2 shares per day.","Fhvi C olttvw rm wzrob, zeviztrmt 2 slfih lu hlxrzo nvwrz xlmhfnkgrlm. Gsvri wzrob ivzwrmt elofnv rh zylfg 15 zigrxovh, drgs hvhhrlm wfizgrlmh zeviztrmt 5 nrmfgvh kvi zigrxov. Fhvi C rmgvizxgh uivjfvmgob, drgs zm zeviztv lu 10 orpvh, 5 xlnnvmgh, zmw 2 hszivh kvi wzb."
Internet Records,User Preferences,"Interest Categories: Technology, Entertainment, Sports; Shopping Preferences: Electronics, Footwear, Books; User Data Summary: This user displays a marked preference for technology-related content, frequently browsing and engaging with articles, videos, and forums centered around new tech releases and software reviews.","Rmgvivhg Xzgvtlirvh: Gvxsmloltb, Vmgvigzrmnvmg, Hkligh; Hslkkrmt Kivuvivmxvh: Vovxgilmrxh, Ullgdvzi, Yllph; Fhvi Wzgz Hfnnzib: Gsrh fhvi wrhkozbh z nzipvw kivuvivmxv uli gvxsmloltb-ivozgvw xlmgvmg, uivjfvmgob yildhrmt zmw vmtztrmt drgs zigrxovh, erwvlh, zmw ulifnh xvmgvivw zilfmw mvd gvxs ivovzhvh zmw hlugdziv ivervdh."
Internet Records,User Preferences,"User X has demonstrated a variety of interest preferences within the Internet Records domain, particularly under the User Preferences subdomain. The interest categories captured include a strong inclination towards fields such as technology, where User X frequently engages with the latest innovations in artificial intelligence and cybersecurity domains.","Fhvi C szh wvnlmhgizgvw z ezirvgb lu rmgvivhg kivuvivmxvh drgsrm gsv Rmgvimvg Ivxliwh wlnzrm, kzigrxfoziob fmwvi gsv Fhvi Kivuvivmxvh hfywlnzrm. Gsv rmgvivhg xzgvtlirvh xzkgfivw rmxofwv z hgilmt rmxormzgrlm gldziwh urvowh hfxs zh gvxsmloltb, dsviv Fhvi C uivjfvmgob vmtztvh drgs gsv ozgvhg rmmlezgrlmh rm zigrurxrzo rmgvoortvmxv zmw xbyvihvxfirgb wlnzrmh."
