domain,sub_domain,plaintext,Atbash
Financial Confidential Data,Banking Information,"Investment Records: ABC Corp Stock - 100 Shares, Value: $15,000, XYZ Growth Fund Investment: $50,000, QRS Municipal Bond - $25,000; Bank Account Information: Account Number: 9639379217, Bank: Example National Bank, Card Number: 9876-5432-1098-7654, Account Type: Savings, Current Balance: $12,500.50, Interest Rate: 0.5%.","Rmevhgnvmg Ivxliwh: ZYX Xlik Hglxp - 100 Hszivh, Ezofv: $15,000, CBA Tildgs Ufmw Rmevhgnvmg: $50,000, JIH Nfmrxrkzo Ylmw - $25,000; Yzmp Zxxlfmg Rmulinzgrlm: Zxxlfmg Mfnyvi: 9639379217, Yzmp: Vcznkov Mzgrlmzo Yzmp, Xziw Mfnyvi: 9876-5432-1098-7654, Zxxlfmg Gbkv: Hzermth, Xfiivmg Yzozmxv: $12,500.50, Rmgvivhg Izgv: 0.5%."
Financial Confidential Data,Banking Information,"Loan Information: Amount: $50,000, Interest Rate: 3.5%, Repayment Plan: Monthly for 5 years, Bank Account Information: Account Number: 24359832475389, Bank: Sample National Bank, Card Number: 4567-1234-5678-9012, Payment Information: Credit Card, Payment Platform ID: 783245907, Timestamp: 2023-09-15T14:38:00Z, Amount: $1,500, Transaction Details: Purchase of Computer (Invoice #789345), Investment Records: TechGrowth Inc. Stock - 30 Shares @$900 each, Global Sustainability Fund - $15,000, Government Bond 10Y - $20,000 (Interest Yield: 1.7%).","Olzm Rmulinzgrlm: Znlfmg: $50,000, Rmgvivhg Izgv: 3.5%, Ivkzbnvmg Kozm: Nlmgsob uli 5 bvzih, Yzmp Zxxlfmg Rmulinzgrlm: Zxxlfmg Mfnyvi: 24359832475389, Yzmp: Hznkov Mzgrlmzo Yzmp, Xziw Mfnyvi: 4567-1234-5678-9012, Kzbnvmg Rmulinzgrlm: Xivwrg Xziw, Kzbnvmg Kozgulin RW: 783245907, Grnvhgznk: 2023-09-15G14:38:00A, Znlfmg: $1,500, Gizmhzxgrlm Wvgzroh: Kfixszhv lu Xlnkfgvi (Rmelrxv #789345), Rmevhgnvmg Ivxliwh: GvxsTildgs Rmx. Hglxp - 30 Hszivh @$900 vzxs, Tolyzo Hfhgzrmzyrorgb Ufmw - $15,000, Tlevimnvmg Ylmw 10B - $20,000 (Rmgvivhg Brvow: 1.7%)."
Financial Confidential Data,Personal Income,"Salary Amount: $67,000, Pay Date: 2023-10-25","Hzozib Znlfmg: $67,000, Kzb Wzgv: 2023-10-25"
Financial Confidential Data,Personal Income,"Name: Alex Smith, Income: $73,250, Pay Date: 2023-09-28, Location: Seattle","Mznv: Zovc Hnrgs, Rmxlnv: $73,250, Kzb Wzgv: 2023-09-28, Olxzgrlm: Hvzggov"
Financial Confidential Data,Personal Income,"Pay Date: 2023-05-15, Income: $75,000, Currency: USD, Bonus: $5,000","Kzb Wzgv: 2023-05-15, Rmxlnv: $75,000, Xfiivmxb: FHW, Ylmfh: $5,000"
Financial Confidential Data,Personal Income,"Tax Number: 001-284-750, Tax Return Records: Filed for 2022 with a $3,200 refund","Gzc Mfnyvi: 001-284-750, Gzc Ivgfim Ivxliwh: Urovw uli 2022 drgs z $3,200 ivufmw"
Financial Confidential Data,Personal Income,"Tax Number: TXN-48970-1256, Tax Return Year: 2022, Declared Income: $152,350, Tax Refund: $3,200","Gzc Mfnyvi: GCM-48970-1256, Gzc Ivgfim Bvzi: 2022, Wvxozivw Rmxlnv: $152,350, Gzc Ivufmw: $3,200"
Financial Confidential Data,Personal Income,"Pay Date: 2023-05-15, Income: $70,000, Currency: USD, Bonus: Q1, Source: Consulting Services","Kzb Wzgv: 2023-05-15, Rmxlnv: $70,000, Xfiivmxb: FHW, Ylmfh: J1, Hlfixv: Xlmhfogrmt Hvierxvh"
Financial Confidential Data,Personal Income,"Name: Alex Smith, Income: $73,250, Pay Date: 2023-09-28, Currency: USD, Employment: Full-Time, Department: Engineering","Mznv: Zovc Hnrgs, Rmxlnv: $73,250, Kzb Wzgv: 2023-09-28, Xfiivmxb: FHW, Vnkolbnvmg: Ufoo-Grnv, Wvkzignvmg: Vmtrmvvirmt"
Financial Confidential Data,Personal Income,"Name: Alex Smith, Salary: $87,500, Pay Frequency: Biweekly, Position: Software Developer, Employee ID: EID-257846, Department: IT","Mznv: Zovc Hnrgs, Hzozib: $87,500, Kzb Uivjfvmxb: Yrdvvpob, Klhrgrlm: Hlugdziv Wvevolkvi, Vnkolbvv RW: VRW-257846, Wvkzignvmg: RG"
Financial Confidential Data,Personal Income,"Salary: $75,000, Tax Information: Tax Number: XX-1234-5678, Tax Return: 2022 Submitted","Hzozib: $75,000, Gzc Rmulinzgrlm: Gzc Mfnyvi: CC-1234-5678, Gzc Ivgfim: 2022 Hfynrggvw"
Financial Confidential Data,Personal Income,"Tax Number: TXN-10294XYZ, Tax Return: 2022 (Completed), Refund: $532.45, Salary: $7,585.90","Gzc Mfnyvi: GCM-10294CBA, Gzc Ivgfim: 2022 (Xlnkovgvw), Ivufmw: $532.45, Hzozib: $7,585.90"
Financial Confidential Data,Personal Income,"Tax Number: 123-45-6789, Tax Return: 2021 - Income: $75,000, Withheld: $15,000; 2022 - Income: $80,000, Withheld: $16,000, Salary: $5,000","Gzc Mfnyvi: 123-45-6789, Gzc Ivgfim: 2021 - Rmxlnv: $75,000, Drgssvow: $15,000; 2022 - Rmxlnv: $80,000, Drgssvow: $16,000, Hzozib: $5,000"
Financial Confidential Data,Personal Income,"Tax Number: TXN-8736-4382, Tax Return Records: [{Year: 2022, Income: $78,500, Tax Paid: $11,775}, {Year: 2023, Income: $80,000, Tax Paid: $12,000}]","Gzc Mfnyvi: GCM-8736-4382, Gzc Ivgfim Ivxliwh: [{Bvzi: 2022, Rmxlnv: $78,500, Gzc Kzrw: $11,775}, {Bvzi: 2023, Rmxlnv: $80,000, Gzc Kzrw: $12,000}]"
Financial Confidential Data,Personal Income,"Name: Alex Smith, Salary: $87,500, Year: 2022, Salary Breakdown: Base: $50,000, Bonus: $25,000, Allowances: $12,500, Tax Withheld: $15,000","Mznv: Zovc Hnrgs, Hzozib: $87,500, Bvzi: 2022, Hzozib Yivzpwldm: Yzhv: $50,000, Ylmfh: $25,000, Zooldzmxvh: $12,500, Gzc Drgssvow: $15,000"
Financial Confidential Data,Personal Income,"Tax Number: TXN-87392-43821, Tax Return Year: 2022, Income Declared: $152,350, Tax Refund: $3,200, Employer: AlphaTech Corp., Filing Status: Single","Gzc Mfnyvi: GCM-87392-43821, Gzc Ivgfim Bvzi: 2022, Rmxlnv Wvxozivw: $152,350, Gzc Ivufmw: $3,200, Vnkolbvi: ZokszGvxs Xlik., Urormt Hgzgfh: Hrmtov"
Financial Confidential Data,Personal Income,"Salary: $67,000, Pay Date: 2023-10-25, Tax Information: Tax Number: TXN897645321, Tax Return Records: [{Year: 2022, Refund: $4,500}, {Year: 2021, Refund: $5,100}]","Hzozib: $67,000, Kzb Wzgv: 2023-10-25, Gzc Rmulinzgrlm: Gzc Mfnyvi: GCM897645321, Gzc Ivgfim Ivxliwh: [{Bvzi: 2022, Ivufmw: $4,500}, {Bvzi: 2021, Ivufmw: $5,100}]"
Financial Confidential Data,Personal Income,"Salary: $78,000 USD, Tax Information: Tax Number: TAX098731257, Tax Return Records: [{Year: 2021, Amount: $12,000}, {Year: 2022, Amount: $13,500}], Pay Date: 2023-10-15","Hzozib: $78,000 FHW, Gzc Rmulinzgrlm: Gzc Mfnyvi: GZC098731257, Gzc Ivgfim Ivxliwh: [{Bvzi: 2021, Znlfmg: $12,000}, {Bvzi: 2022, Znlfmg: $13,500}], Kzb Wzgv: 2023-10-15"
Financial Confidential Data,Personal Income,"Pay Date: 2023-09-09, Tax Information: Tax Number: XY-123-456-789, Salary: $58,000","Kzb Wzgv: 2023-09-09, Gzc Rmulinzgrlm: Gzc Mfnyvi: CB-123-456-789, Hzozib: $58,000"
Financial Confidential Data,Personal Income,"Pay Date: 2024-12-30, Salary: $7,850.00 USD, Extra: {Currency: USD, Pay Frequency: Monthly, Source: Company Payroll}, Last Increment Date: 2023-04-01, Employee Pay Grade: Level 4","Kzb Wzgv: 2024-12-30, Hzozib: $7,850.00 FHW, Vcgiz: {Xfiivmxb: FHW, Kzb Uivjfvmxb: Nlmgsob, Hlfixv: Xlnkzmb Kzbiloo}, Ozhg Rmxivnvmg Wzgv: 2023-04-01, Vnkolbvv Kzb Tizwv: Ovevo 4"
Financial Confidential Data,Personal Income,"Pay Date: 2023-05-15, Tax Information: Tax Number: TXN123456789, Tax Return Records: [{Year: 2022, Status: Filed, Amount: $450}, {Year: 2021, Status: Filed, Amount: $375}], Annual Income: $75,000","Kzb Wzgv: 2023-05-15, Gzc Rmulinzgrlm: Gzc Mfnyvi: GCM123456789, Gzc Ivgfim Ivxliwh: [{Bvzi: 2022, Hgzgfh: Urovw, Znlfmg: $450}, {Bvzi: 2021, Hgzgfh: Urovw, Znlfmg: $375}], Zmmfzo Rmxlnv: $75,000"
Financial Confidential Data,Personal Income,"Individual ID: XI258963J, Tax Number: TX-78421A7, Annual Income: $95,200, Tax Return Records: [{Year: 2021, Refund: $350}, {Year: 2022, Refund: $220}], Pay Dates: [2023-02-25, 2023-03-25, 2023-04-25], Monthly Income: $7,933","Rmwrerwfzo RW: CR258963Q, Gzc Mfnyvi: GC-78421Z7, Zmmfzo Rmxlnv: $95,200, Gzc Ivgfim Ivxliwh: [{Bvzi: 2021, Ivufmw: $350}, {Bvzi: 2022, Ivufmw: $220}], Kzb Wzgvh: [2023-02-25, 2023-03-25, 2023-04-25], Nlmgsob Rmxlnv: $7,933"
Financial Confidential Data,Personal Income,"Individual ID: 302145, Salary: $87,260 USD, Tax Number: JZ098731257, Tax Year: 2022, Tax Paid: $18,564, Dependents: 3, Employment: Full-time, Employer: SRP Tech Solutions, Income Source: Annual Salary, Refund Status: Approved, Refund Amount: $1,320, Filing Method: Electronic, Filing Date: 03-April-2023, Tax Advisor: Barry Winslow CPA","Rmwrerwfzo RW: 302145, Hzozib: $87,260 FHW, Gzc Mfnyvi: QA098731257, Gzc Bvzi: 2022, Gzc Kzrw: $18,564, Wvkvmwvmgh: 3, Vnkolbnvmg: Ufoo-grnv, Vnkolbvi: HIK Gvxs Hlofgrlmh, Rmxlnv Hlfixv: Zmmfzo Hzozib, Ivufmw Hgzgfh: Zkkilevw, Ivufmw Znlfmg: $1,320, Urormt Nvgslw: Vovxgilmrx, Urormt Wzgv: 03-Zkiro-2023, Gzc Zwerhli: Yziib Drmhold XKZ"
Internet Records,Browsing Records,"User navigated the site, starting with the page titled 'Latest Tech Innovations'","Fhvi mzertzgvw gsv hrgv, hgzigrmt drgs gsv kztv grgovw 'Ozgvhg Gvxs Rmmlezgrlmh'"
Internet Records,Browsing Records,User123 visited the website at 09:12 AM and spent 7 minutes on the homepage.,Fhvi123 erhrgvw gsv dvyhrgv zg 09:12 ZN zmw hkvmg 7 nrmfgvh lm gsv slnvkztv.
Internet Records,Browsing Records,"Accessed URL: http://github.com/product/12345, Access Timestamp: 2023-10-21T14:32:15Z.","Zxxvhhvw FIO: sggk://trgsfy.xln/kilwfxg/12345, Zxxvhh Grnvhgznk: 2023-10-21G14:32:15A."
Internet Records,Browsing Records,"On June 5, 2023, David searched for 'best budget smartphones 2023' on a popular search engine.","Lm Qfmv 5, 2023, Wzerw hvzixsvw uli 'yvhg yfwtvg hnzigkslmvh 2023' lm z klkfozi hvzixs vmtrmv."
Internet Records,Browsing Records,User visited the webpage titled 'Latest Tech Innovations 2023' and spent approximately 7 minutes and 42 seconds exploring the content.,Fhvi erhrgvw gsv dvykztv grgovw 'Ozgvhg Gvxs Rmmlezgrlmh 2023' zmw hkvmg zkkilcrnzgvob 7 nrmfgvh zmw 42 hvxlmwh vckolirmt gsv xlmgvmg.
Internet Records,Browsing Records,"User Device Information: Operating System: Android 11, Device Model: Samsung Galaxy S20; Network Information: IP Address: 192.168.1.24","Fhvi Wverxv Rmulinzgrlm: Lkvizgrmt Hbhgvn: Zmwilrw 11, Wverxv Nlwvo: Hznhfmt Tzozcb H20; Mvgdlip Rmulinzgrlm: RK Zwwivhh: 192.168.1.24"
Internet Records,Browsing Records,"Webpage Title: 'Understanding Quantum Computing: Future of Technology and Science'; Search Keywords: 'quantum computing basics', 'how does quantum computing work', 'future technology trends'.","Dvykztv Grgov: 'Fmwvihgzmwrmt Jfzmgfn Xlnkfgrmt: Ufgfiv lu Gvxsmloltb zmw Hxrvmxv'; Hvzixs Pvbdliwh: 'jfzmgfn xlnkfgrmt yzhrxh', 'sld wlvh jfzmgfn xlnkfgrmt dlip', 'ufgfiv gvxsmloltb givmwh'."
Internet Records,Browsing Records,"Access Timestamps: 2023-10-21T14:32:05Z, 2023-10-21T14:34:12Z, 2023-10-21T15:05:30Z; Browsing Path: Homepage > Products > Electronics > Smartphones > Product Details > Reviews > Checkout Page.","Zxxvhh Grnvhgznkh: 2023-10-21G14:32:05A, 2023-10-21G14:34:12A, 2023-10-21G15:05:30A; Yildhrmt Kzgs: Slnvkztv > Kilwfxgh > Vovxgilmrxh > Hnzigkslmvh > Kilwfxg Wvgzroh > Ivervdh > Xsvxplfg Kztv."
Internet Records,Browsing Records,"User navigated to the 'Latest Gadget Reviews' webpage, engaging with various interactive elements. The user's mouse frequently hovered over embedded video content, showing interest in multimedia.","Fhvi mzertzgvw gl gsv 'Ozgvhg Tzwtvg Ivervdh' dvykztv, vmtztrmt drgs ezirlfh rmgvizxgrev vovnvmgh. Gsv fhvi'h nlfhv uivjfvmgob slevivw levi vnyvwwvw erwvl xlmgvmg, hsldrmt rmgvivhg rm nfogrnvwrz."
Internet Records,Browsing Records,"User device information: Operating System: TechOS v5.4, Device Model: GizmoMax Ultimate 2023; Browser: FastWeb Browser v15.2.1.","Fhvi wverxv rmulinzgrlm: Lkvizgrmt Hbhgvn: GvxsLH e5.4, Wverxv Nlwvo: TranlNzc Fogrnzgv 2023; Yildhvi: UzhgDvy Yildhvi e15.2.1."
Internet Records,Browsing Records,"User browsed an online shopping site starting at the homepage, hovering over the electronics category before clicking into it. They lingered on multiple product pages, scrolling and comparing specifications.","Fhvi yildhvw zm lmormv hslkkrmt hrgv hgzigrmt zg gsv slnvkztv, slevirmt levi gsv vovxgilmrxh xzgvtlib yvuliv xorxprmt rmgl rg. Gsvb ormtvivw lm nfogrkov kilwfxg kztvh, hxiloormt zmw xlnkzirmt hkvxrurxzgrlmh."
Internet Records,Browsing Records,"Geolocation: 37.7749° N, 122.4194° W (San Francisco, CA), Network Type: Wi-Fi; Accessed via an Apple iPhone, iOS 16, connected to an AT&T router, with consistent IP address, ensuring seamless browsing.","Tvlolxzgrlm: 37.7749° M, 122.4194° D (Hzm Uizmxrhxl, XZ), Mvgdlip Gbkv: Dr-Ur; Zxxvhhvw erz zm Zkkov rKslmv, rLH 16, xlmmvxgvw gl zm ZG&G ilfgvi, drgs xlmhrhgvmg RK zwwivhh, vmhfirmt hvznovhh yildhrmt."
Internet Records,Browsing Records,"Operating System: Android 10; Device Model: Samsung Galaxy S10; IP Address: 192.168.1.1; Geolocation: New York, USA (based on IP); Browser: Chrome 89.0; Screen Resolution: 1440x3040 pixels; Network: WiFi; Timestamp: 2023-10-15T14:23:00Z.","Lkvizgrmt Hbhgvn: Zmwilrw 10; Wverxv Nlwvo: Hznhfmt Tzozcb H10; RK Zwwivhh: 192.168.1.1; Tvlolxzgrlm: Mvd Blip, FHZ (yzhvw lm RK); Yildhvi: Xsilnv 89.0; Hxivvm Ivhlofgrlm: 1440c3040 krcvoh; Mvgdlip: DrUr; Grnvhgznk: 2023-10-15G14:23:00A."
Internet Records,Browsing Records,"User123, a registered guest, visited NewsToday.com on 15th October 2023. Over 45 minutes, they interacted with multiple pages including homepage, technology, and lifestyle sections. They clicked on 15 articles and hovered over headlines.","Fhvi123, z ivtrhgvivw tfvhg, erhrgvw MvdhGlwzb.xln lm 15gs Lxglyvi 2023. Levi 45 nrmfgvh, gsvb rmgvizxgvw drgs nfogrkov kztvh rmxofwrmt slnvkztv, gvxsmloltb, zmw oruvhgbov hvxgrlmh. Gsvb xorxpvw lm 15 zigrxovh zmw slevivw levi svzwormvh."
Internet Records,Browsing Records,"Accessed URL: https://mason.com; Page Interaction: User scrolled through the entire page, clicked on three product images, hovered over the Add to Cart button for 10 seconds, navigated to reviews section, and spent 5 minutes on the page.","Zxxvhhvw FIO: sggkh://nzhlm.xln; Kztv Rmgvizxgrlm: Fhvi hxiloovw gsilfts gsv vmgriv kztv, xorxpvw lm gsivv kilwfxg rnztvh, slevivw levi gsv Zww gl Xzig yfgglm uli 10 hvxlmwh, mzertzgvw gl ivervdh hvxgrlm, zmw hkvmg 5 nrmfgvh lm gsv kztv."
Internet Records,Browsing Records,"User 10234 spent 12 minutes on the webpage exploring articles on sustainable architecture, entering search keywords like 'eco-friendly building materials' and 'green urban planning,' indicating a growing interest in sustainable design.","Fhvi 10234 hkvmg 12 nrmfgvh lm gsv dvykztv vckolirmt zigrxovh lm hfhgzrmzyov zixsrgvxgfiv, vmgvirmt hvzixs pvbdliwh orpv 'vxl-uirvmwob yfrowrmt nzgvirzoh' zmw 'tivvm fiyzm kozmmrmt,' rmwrxzgrmt z tildrmt rmgvivhg rm hfhgzrmzyov wvhrtm."
Internet Records,Browsing Records,"User accessed a retail website on 2023-10-07T14:23:56, engaging in browsing behavior including clicking on four product links, spending 2 minutes per page, scrolling intermittently, and pausing on sections featuring customer reviews and product recommendations.","Fhvi zxxvhhvw z ivgzro dvyhrgv lm 2023-10-07G14:23:56, vmtztrmt rm yildhrmt yvszerli rmxofwrmt xorxprmt lm ulfi kilwfxg ormph, hkvmwrmt 2 nrmfgvh kvi kztv, hxiloormt rmgvinrggvmgob, zmw kzfhrmt lm hvxgrlmh uvzgfirmt xfhglnvi ivervdh zmw kilwfxg ivxlnnvmwzgrlmh."
Internet Records,Browsing Records,"User JohnDoe visited the 'Home Gardening Tips' page on April 12, 2023, at 10:32 AM, and again later that day at 07:45 PM, checking for updates. The page title reflects their interest in sustainable living and DIY projects.","Fhvi QlsmWlv erhrgvw gsv 'Slnv Tziwvmrmt Grkh' kztv lm Zkiro 12, 2023, zg 10:32 ZN, zmw ztzrm ozgvi gszg wzb zg 07:45 KN, xsvxprmt uli fkwzgvh. Gsv kztv grgov ivuovxgh gsvri rmgvivhg rm hfhgzrmzyov orermt zmw WRB kilqvxgh."
Internet Records,Browsing Records,"User session on 2023-10-20 at 14:00:34: Download Records: {File Name: project_details.docx, Download Time: 14:02:17, File Size: 2.5 MB}, {File Name: holiday_photos.zip, Download Time: 14:15:48, File Size: 50 MB}; Browser Cache: {Webpage: example.com/news, Cached Time: 14:10:05, Cache Size: 350 KB}, {Webpage: example.com/shop, Cached Time: 14:20:35, Cache Size: 120 KB}.","Fhvi hvhhrlm lm 2023-10-20 zg 14:00:34: Wldmolzw Ivxliwh: {Urov Mznv: kilqvxg_wvgzroh.wlxc, Wldmolzw Grnv: 14:02:17, Urov Hrav: 2.5 NY}, {Urov Mznv: slorwzb_kslglh.ark, Wldmolzw Grnv: 14:15:48, Urov Hrav: 50 NY}; Yildhvi Xzxsv: {Dvykztv: vcznkov.xln/mvdh, Xzxsvw Grnv: 14:10:05, Xzxsv Hrav: 350 PY}, {Dvykztv: vcznkov.xln/hslk, Xzxsvw Grnv: 14:20:35, Xzxsv Hrav: 120 PY}."
Internet Records,Browsing Records,"User ID: 123456; Date & Time: 2023-10-15 14:35:27; Browsing Path: Home > Products > Electronics > Laptops > Accessories > Checkout; Search Keywords: 'best laptop accessories 2023', 'buy affordable laptop charger', 'eco-friendly laptop case reviews'; Time Spent: 23 minutes; Device: Desktop; Browser: Chrome; Location: SLA City.","Fhvi RW: 123456; Wzgv & Grnv: 2023-10-15 14:35:27; Yildhrmt Kzgs: Slnv > Kilwfxgh > Vovxgilmrxh > Ozkglkh > Zxxvhhlirvh > Xsvxplfg; Hvzixs Pvbdliwh: 'yvhg ozkglk zxxvhhlirvh 2023', 'yfb zuuliwzyov ozkglk xszitvi', 'vxl-uirvmwob ozkglk xzhv ivervdh'; Grnv Hkvmg: 23 nrmfgvh; Wverxv: Wvhpglk; Yildhvi: Xsilnv; Olxzgrlm: HOZ Xrgb."
Internet Records,Browsing Records,"On October 12, 2023, at 02:45 PM, the user accessed a gardening tools website. They searched for 'best indoor plant care tips,' 'eco-friendly fertilizers,' and 'balcony garden ideas,' adding several items to their wishlist, indicating purchase intent for sustainable gardening products.","Lm Lxglyvi 12, 2023, zg 02:45 KN, gsv fhvi zxxvhhvw z tziwvmrmt glloh dvyhrgv. Gsvb hvzixsvw uli 'yvhg rmwlli kozmg xziv grkh,' 'vxl-uirvmwob uvigroravih,' zmw 'yzoxlmb tziwvm rwvzh,' zwwrmt hvevizo rgvnh gl gsvri drhsorhg, rmwrxzgrmt kfixszhv rmgvmg uli hfhgzrmzyov tziwvmrmt kilwfxgh."
Internet Records,Browsing Records,"User accessed the page www.misccc.com/article at 2023-11-01T08:34:22Z, spending 5 minutes and 23 seconds engaging with multiple hyperlinks before exiting to a related topic page. They returned at 2023-11-01T09:12:47Z, reading a blog post for 12 minutes and 45 seconds, interacting with several ads, indicating high user engagement.","Fhvi zxxvhhvw gsv kztv ddd.nrhxxx.xln/zigrxov zg 2023-11-01G08:34:22A, hkvmwrmt 5 nrmfgvh zmw 23 hvxlmwh vmtztrmt drgs nfogrkov sbkviormph yvuliv vcrgrmt gl z ivozgvw glkrx kztv. Gsvb ivgfimvw zg 2023-11-01G09:12:47A, ivzwrmt z yolt klhg uli 12 nrmfgvh zmw 45 hvxlmwh, rmgvizxgrmt drgs hvevizo zwh, rmwrxzgrmt srts fhvi vmtztvnvmg."
Internet Records,Cookie Data,"user_id: usr456def, session_id: sess101112.","fhvi_rw: fhi456wvu, hvhhrlm_rw: hvhh101112."
Internet Records,Cookie Data,"usr_38917, Session ID: sess_473829, Last Access Time: 2023-10-24T14:37:23Z.","fhi_38917, Hvhhrlm RW: hvhh_473829, Ozhg Zxxvhh Grnv: 2023-10-24G14:37:23A."
Internet Records,Cookie Data,User-A12345 added a digital camera to their shopping cart on an e-commerce platform.,Fhvi-Z12345 zwwvw z wrtrgzo xznviz gl gsvri hslkkrmt xzig lm zm v-xlnnvixv kozgulin.
Internet Records,Cookie Data,"TrackingID=xyz123; BehavioralData=[{page:/home, timeSpent:120}, {page:/products, category:electronics, interaction:click, timeSpent:45}]; AdTargetingSegments=[tech enthusiasts, online shoppers].","GizxprmtRW=cba123; YvszerlizoWzgz=[{kztv:/slnv, grnvHkvmg:120}, {kztv:/kilwfxgh, xzgvtlib:vovxgilmrxh, rmgvizxgrlm:xorxp, grnvHkvmg:45}]; ZwGzitvgrmtHvtnvmgh=[gvxs vmgsfhrzhgh, lmormv hslkkvih]."
Internet Records,Cookie Data,"Persistent Cookie: [session-id: XYZ123456789, expires: 2024-10-10, domain: education.com].","Kvihrhgvmg Xllprv: [hvhhrlm-rw: CBA123456789, vckrivh: 2024-10-10, wlnzrm: vwfxzgrlm.xln]."
Internet Records,Cookie Data,"CookieID12345 maintains login status for UserID98765 on www.business.com, facilitating seamless access. Analytics tracks UserID98765's engagement, documenting 500 page views and a click-through rate of 4.5% across the session.","XllprvRW12345 nzrmgzrmh oltrm hgzgfh uli FhviRW98765 lm ddd.yfhrmvhh.xln, uzxrorgzgrmt hvznovhh zxxvhh. Zmzobgrxh gizxph FhviRW98765'h vmtztvnvmg, wlxfnvmgrmt 500 kztv ervdh zmw z xorxp-gsilfts izgv lu 4.5% zxilhh gsv hvhhrlm."
Internet Records,Cookie Data,"{cookie_id: abc123xyz, user_id: user789, session_id: sess456, login_status: logged_in, timestamp: 2023-11-16T09:15:00Z, preferences: {theme: dark, language: en}, visit_count: 3, login_credentials: {username: SAM, auth_token: token12345abc}}.","{xllprv_rw: zyx123cba, fhvi_rw: fhvi789, hvhhrlm_rw: hvhh456, oltrm_hgzgfh: olttvw_rm, grnvhgznk: 2023-11-16G09:15:00A, kivuvivmxvh: {gsvnv: wzip, ozmtfztv: vm}, erhrg_xlfmg: 3, oltrm_xivwvmgrzoh: {fhvimznv: HZN, zfgs_glpvm: glpvm12345zyx}}."
Internet Records,Cookie Data,"In a recent simulation of internet usage, the browser activity of a user included several types of cookies, highlighting privacy dynamics on modern web platforms. Among them were third-party cookies, set by analytics services, and secure cookies from financial websites.","Rm z ivxvmg hrnfozgrlm lu rmgvimvg fhztv, gsv yildhvi zxgrergb lu z fhvi rmxofwvw hvevizo gbkvh lu xllprvh, srtsortsgrmt kirezxb wbmznrxh lm nlwvim dvy kozgulinh. Znlmt gsvn dviv gsriw-kzigb xllprvh, hvg yb zmzobgrxh hvierxvh, zmw hvxfiv xllprvh uiln urmzmxrzo dvyhrgvh."
Internet Records,Cookie Data,"User's shopping cart contains 3 items: Bluetooth Headphones, Wireless Mouse, and Smartphone Case. Total basket value: $125.98. Items added on 2023-10-08 at 14:45. Cookie data encrypted using AES-256 encryption. Encrypted status: Enabled. Session ID: 76a09b1452f9ac3e2173e484.","Fhvi'h hslkkrmt xzig xlmgzrmh 3 rgvnh: Yofvgllgs Svzwkslmvh, Drivovhh Nlfhv, zmw Hnzigkslmv Xzhv. Glgzo yzhpvg ezofv: $125.98. Rgvnh zwwvw lm 2023-10-08 zg 14:45. Xllprv wzgz vmxibkgvw fhrmt ZVH-256 vmxibkgrlm. Vmxibkgvw hgzgfh: Vmzyovw. Hvhhrlm RW: 76z09y1452u9zx3v2173v484."
Internet Records,Cookie Data,"User 234 has a shopping cart with items: a blue cotton t-shirt (medium size, $20) and a pair of black running shoes (size 9, $50). Total: $70. Last login: 2023-10-14, using email: lab.wj@email.com, no password saved. Session was active for 45 minutes, updated on 2023-10-15.","Fhvi 234 szh z hslkkrmt xzig drgs rgvnh: z yofv xlgglm g-hsrig (nvwrfn hrav, $20) zmw z kzri lu yozxp ifmmrmt hslvh (hrav 9, $50). Glgzo: $70. Ozhg oltrm: 2023-10-14, fhrmt vnzro: ozy.dq@vnzro.xln, ml kzhhdliw hzevw. Hvhhrlm dzh zxgrev uli 45 nrmfgvh, fkwzgvw lm 2023-10-15."
Internet Records,Cookie Data,"Cookie ID: C123XYZ456; User ID: U789ABC321; Language Preference: English; Theme Color: Dark; Last Visit: 2023-09-28; Ad Interests: {Technology, Travel, Fashion}; Click Behavior: {Ad123: 2 clicks, Ad456: 5 clicks, Ad789: 1 click}; Purchase History: {ItemA: $50, ItemB: $30}; Session Duration: 25 minutes; Location: San Francisco, Mobile Device; Analytics Timestamp: 2023-09-28T14:23:06Z; IP Anonymized: 192.0.2.1; Consent Given: True.","Xllprv RW: X123CBA456; Fhvi RW: F789ZYX321; Ozmtfztv Kivuvivmxv: Vmtorhs; Gsvnv Xloli: Wzip; Ozhg Erhrg: 2023-09-28; Zw Rmgvivhgh: {Gvxsmloltb, Gizevo, Uzhsrlm}; Xorxp Yvszerli: {Zw123: 2 xorxph, Zw456: 5 xorxph, Zw789: 1 xorxp}; Kfixszhv Srhglib: {RgvnZ: $50, RgvnY: $30}; Hvhhrlm Wfizgrlm: 25 nrmfgvh; Olxzgrlm: Hzm Uizmxrhxl, Nlyrov Wverxv; Zmzobgrxh Grnvhgznk: 2023-09-28G14:23:06A; RK Zmlmbnravw: 192.0.2.1; Xlmhvmg Trevm: Gifv."
Internet Records,User Preferences,"User ID: U234567890, Preferred Video Genres: Drama, Crime.","Fhvi RW: F234567890, Kivuviivw Erwvl Tvmivh: Wiznz, Xirnv."
Internet Records,User Preferences,User: John; Active Time Periods: 12:00-14:00 and 18:00-21:00.,Fhvi: Qlsm; Zxgrev Grnv Kvirlwh: 12:00-14:00 zmw 18:00-21:00.
Internet Records,User Preferences,User George frequently purchases beauty products and home decor items.,Fhvi Tvlitv uivjfvmgob kfixszhvh yvzfgb kilwfxgh zmw slnv wvxli rgvnh.
Internet Records,User Preferences,User B prefers German as their primary language with a fallback to English.,Fhvi Y kivuvih Tvinzm zh gsvri kirnzib ozmtfztv drgs z uzooyzxp gl Vmtorhs.
Internet Records,User Preferences,User A prefers English as their primary language with a fallback option to Spanish.,Fhvi Z kivuvih Vmtorhs zh gsvri kirnzib ozmtfztv drgs z uzooyzxp lkgrlm gl Hkzmrhs.
Internet Records,User Preferences,"User ID: 67890; Preferred Video Genres: Comedy, Thriller; Article Topics: Career Development.","Fhvi RW: 67890; Kivuviivw Erwvl Tvmivh: Xlnvwb, Gsiroovi; Zigrxov Glkrxh: Xzivvi Wvevolknvmg."
Internet Records,User Preferences,"User ID: U345678901, Device Usage Habits: Primarily uses a tablet for social media browsing in the evenings.","Fhvi RW: F345678901, Wverxv Fhztv Szyrgh: Kirnzirob fhvh z gzyovg uli hlxrzo nvwrz yildhrmt rm gsv vevmrmth."
Internet Records,User Preferences,"User ID: U101, Device Usage Habits: Frequently accesses social media platforms via smartphone during evening hours.","Fhvi RW: F101, Wverxv Fhztv Szyrgh: Uivjfvmgob zxxvhhvh hlxrzo nvwrz kozgulinh erz hnzigkslmv wfirmt vevmrmt slfih."
Internet Records,User Preferences,"User activity peaks between 6 AM and 8 AM on weekdays, primarily using smartphones. On weekends, usage shifts to laptops, with activity concentrated between 10 AM and 4 PM.","Fhvi zxgrergb kvzph yvgdvvm 6 ZN zmw 8 ZN lm dvvpwzbh, kirnzirob fhrmt hnzigkslmvh. Lm dvvpvmwh, fhztv hsrugh gl ozkglkh, drgs zxgrergb xlmxvmgizgvw yvgdvvm 10 ZN zmw 4 KN."
Internet Records,User Preferences,"The simulation of privacy data in the Internet Records domain, specifically within the User Preferences subdomain focusing on Behavioral Habits, reveals intriguing patterns.","Gsv hrnfozgrlm lu kirezxb wzgz rm gsv Rmgvimvg Ivxliwh wlnzrm, hkvxrurxzoob drgsrm gsv Fhvi Kivuvivmxvh hfywlnzrm ulxfhrmt lm Yvszerlizo Szyrgh, ivevzoh rmgirtfrmt kzggvimh."
Internet Records,User Preferences,"User A logs in daily, spending 1 hour on social media. They read 8 articles daily, focusing on health and wellness, and interact by liking 5 posts and commenting twice per day.","Fhvi Z olth rm wzrob, hkvmwrmt 1 slfi lm hlxrzo nvwrz. Gsvb ivzw 8 zigrxovh wzrob, ulxfhrmt lm svzogs zmw dvoomvhh, zmw rmgvizxg yb orprmt 5 klhgh zmw xlnnvmgrmt gdrxv kvi wzb."
